{
  "contract": 1,
  "now": "2026-09-15T14:02:11Z",
  "summary": {
    "status": "fail",
    "pass": 3,
    "warn": 0,
    "fail": 1
  },
  "results": [
    {
      "code": "NOT_YET_VALID",
      "status": "pass",
      "rule": {
        "name": "validityStarted"
      },
      "message": "the certificate is valid from 2024-03-13T00:00:00Z",
      "actual": "2024-03-13T00:00:00Z",
      "expected": "2026-09-15T14:02:11Z"
    },
    {
      "code": "EXPIRED",
      "status": "pass",
      "rule": {
        "name": "validityNotEnded"
      },
      "message": "the certificate is valid until 2027-03-12T23:59:59Z",
      "actual": "2027-03-12T23:59:59Z",
      "expected": "2026-09-15T14:02:11Z"
    },
    {
      "code": "EKU_NOT_PERMITTED",
      "status": "pass",
      "rule": {
        "name": "ekuAllows",
        "value": [
          "1.3.6.1.5.5.7.3.1"
        ]
      },
      "message": "the Extended Key Usage extension lists clientAuth, serverAuth, which includes serverAuth",
      "actual": [
        "clientAuth",
        "serverAuth"
      ],
      "expected": [
        "serverAuth"
      ]
    },
    {
      "code": "TARGET_NOT_END_ENTITY",
      "status": "fail",
      "rule": {
        "name": "expectKind",
        "value": "end-entity"
      },
      "message": "the target is a ca certificate, not an end-entity one",
      "actual": "ca",
      "expected": "end-entity"
    }
  ],
  "policy": {
    "contract": 1,
    "validityStarted": {
      "severity": "fail"
    },
    "validityNotEnded": {
      "severity": "fail"
    },
    "ekuAllows": {
      "value": [
        "1.3.6.1.5.5.7.3.1"
      ],
      "severity": "fail"
    },
    "expectKind": {
      "value": "end-entity",
      "severity": "fail"
    }
  },
  "observation": {
    "contract": 1,
    "format": "x509",
    "observation": {
      "at": "2026-09-15T14:02:11Z",
      "source": {
        "kind": "file",
        "ref": "issuing-ca-1.crt"
      }
    },
    "target": 0,
    "certificates": [
      {
        "index": 0,
        "kind": "ca",
        "selfSigned": false,
        "issuedBy": [],
        "subject": {
          "cn": "Example Issuing CA 1",
          "dn": "C=US, O=Example Trust, CN=Example Issuing CA 1"
        },
        "issuer": {
          "cn": "Example Root CA",
          "dn": "C=US, O=Example Trust, CN=Example Root CA"
        },
        "serial": "8EEF33269BB1958043239FE8636AA688",
        "notBefore": "2024-03-13T00:00:00Z",
        "notAfter": "2027-03-12T23:59:59Z",
        "san": {
          "dns": [],
          "ip": [],
          "email": [],
          "uri": []
        },
        "eku": [
          "clientAuth",
          "serverAuth"
        ],
        "key": {
          "algorithm": "rsa",
          "size": 2048,
          "curve": null
        },
        "sha256": "8e10e535f20540324a29d812b4101da63eae2277782f748a8cc4961daffc160b",
        "spkiSha256": "8d9025f5e5f01ef4262114752ad51533bab89aa93ae63c4a910b09cbb94bbc23",
        "derived": {
          "daysRemaining": 178.4,
          "lifetimeFraction": 0.84
        }
      }
    ],
    "warnings": []
  }
}
