{
  "contract": 1,
  "now": "2026-09-15T14:02:11Z",
  "summary": {
    "status": "fail",
    "pass": 3,
    "warn": 0,
    "fail": 1
  },
  "results": [
    {
      "code": "NOT_YET_VALID",
      "status": "pass",
      "rule": {
        "name": "validityStarted"
      },
      "message": "the certificate is valid from 2026-08-01T00:00:00Z",
      "actual": "2026-08-01T00:00:00Z",
      "expected": "2026-09-15T14:02:11Z"
    },
    {
      "code": "EXPIRED",
      "status": "pass",
      "rule": {
        "name": "validityNotEnded"
      },
      "message": "the certificate is valid until 2026-10-30T00:00:00Z",
      "actual": "2026-10-30T00:00:00Z",
      "expected": "2026-09-15T14:02:11Z"
    },
    {
      "code": "TARGET_NOT_END_ENTITY",
      "status": "pass",
      "rule": {
        "name": "expectKind",
        "value": "end-entity"
      },
      "message": "the target is an end-entity certificate",
      "actual": "end-entity",
      "expected": "end-entity"
    },
    {
      "code": "ISSUER_NOT_ALLOWED",
      "status": "fail",
      "rule": {
        "name": "issuerAllowed",
        "value": [
          "Other CA"
        ]
      },
      "message": "the issuer Example Issuing CA 1 is not one of the allowed issuers",
      "actual": "Example Issuing CA 1",
      "expected": [
        "Other CA"
      ]
    }
  ],
  "policy": {
    "contract": 1,
    "validityStarted": {
      "severity": "fail"
    },
    "validityNotEnded": {
      "severity": "fail"
    },
    "expectKind": {
      "value": "end-entity",
      "severity": "fail"
    }
  },
  "observation": {
    "contract": 1,
    "format": "x509",
    "observation": {
      "at": "2026-09-15T14:02:11Z",
      "source": {
        "kind": "file",
        "ref": "api.example.com.crt"
      }
    },
    "target": 0,
    "certificates": [
      {
        "index": 0,
        "kind": "end-entity",
        "selfSigned": false,
        "issuedBy": [],
        "subject": {
          "cn": "api.example.com",
          "dn": "CN=api.example.com"
        },
        "issuer": {
          "cn": "Example Issuing CA 1",
          "dn": "C=US, O=Example Trust, CN=Example Issuing CA 1"
        },
        "serial": "AA584DEEFA2F58F4AD042288F149DD4C",
        "notBefore": "2026-08-01T00:00:00Z",
        "notAfter": "2026-10-30T00:00:00Z",
        "san": {
          "dns": [
            "api.example.com",
            "www.example.com"
          ],
          "ip": [],
          "email": [],
          "uri": []
        },
        "eku": [
          "serverAuth"
        ],
        "key": {
          "algorithm": "ec",
          "size": 256,
          "curve": "P-256"
        },
        "sha256": "872a229969048f8dffb599a463b6438a35aa16c6eba1922db552e8560bccd508",
        "spkiSha256": "d0c79a95047112b0e0e0c54cbe30e91b6d850cc0dea4f94543ad5ff9448d51bd",
        "derived": {
          "daysRemaining": 44.4,
          "lifetimeFraction": 0.51
        }
      }
    ],
    "warnings": []
  }
}
