{
  "contract": 1,
  "now": "2026-09-15T14:02:11Z",
  "summary": {
    "status": "pass",
    "pass": 8,
    "warn": 0,
    "fail": 0
  },
  "results": [
    {
      "code": "NOT_YET_VALID",
      "status": "pass",
      "rule": {
        "name": "validityStarted"
      },
      "message": "the certificate is valid from 2026-08-01T00:00:00Z",
      "actual": "2026-08-01T00:00:00Z",
      "expected": "2026-09-15T14:02:11Z"
    },
    {
      "code": "EXPIRED",
      "status": "pass",
      "rule": {
        "name": "validityNotEnded"
      },
      "message": "the certificate is valid until 2026-10-30T00:00:00Z",
      "actual": "2026-10-30T00:00:00Z",
      "expected": "2026-09-15T14:02:11Z"
    },
    {
      "code": "EXPIRES_SOON",
      "status": "pass",
      "rule": {
        "name": "expiresWithin",
        "value": "14d"
      },
      "message": "44.4 days are left, not below 14d",
      "actual": 3837469,
      "expected": 1209600
    },
    {
      "code": "LIFETIME_USED_EXCEEDED",
      "status": "pass",
      "rule": {
        "name": "maxLifetimeUsed",
        "value": 0.8
      },
      "message": "51% of the lifetime is used, within 80%",
      "actual": 0.5064983281893004,
      "expected": 0.8
    },
    {
      "code": "EKU_MISSING",
      "status": "pass",
      "rule": {
        "name": "expectEku",
        "value": [
          "serverAuth"
        ]
      },
      "message": "the Extended Key Usage extension lists serverAuth, which includes serverAuth",
      "actual": [
        "serverAuth"
      ],
      "expected": [
        "serverAuth"
      ]
    },
    {
      "code": "SAN_MISSING",
      "status": "pass",
      "rule": {
        "name": "expectSan",
        "value": [
          "api.example.com"
        ]
      },
      "message": "the certificate lists every expected name",
      "actual": {
        "dns": [
          "api.example.com",
          "www.example.com"
        ],
        "ip": []
      },
      "expected": {
        "dns": [
          "api.example.com"
        ],
        "ip": []
      }
    },
    {
      "code": "FINGERPRINT_MISMATCH",
      "status": "pass",
      "rule": {
        "name": "expectFingerprint",
        "value": "872a229969048f8dffb599a463b6438a35aa16c6eba1922db552e8560bccd508"
      },
      "message": "the certificate has the expected fingerprint",
      "actual": "872a229969048f8dffb599a463b6438a35aa16c6eba1922db552e8560bccd508",
      "expected": "872a229969048f8dffb599a463b6438a35aa16c6eba1922db552e8560bccd508"
    },
    {
      "code": "TARGET_NOT_END_ENTITY",
      "status": "pass",
      "rule": {
        "name": "expectKind",
        "value": "end-entity"
      },
      "message": "the target is an end-entity certificate",
      "actual": "end-entity",
      "expected": "end-entity"
    }
  ],
  "policy": {
    "contract": 1,
    "validityStarted": {
      "severity": "fail"
    },
    "validityNotEnded": {
      "severity": "fail"
    },
    "expiresWithin": {
      "value": "14d",
      "severity": "fail"
    },
    "maxLifetimeUsed": {
      "value": 0.8,
      "severity": "fail"
    },
    "expectEku": {
      "value": [
        "serverAuth"
      ],
      "severity": "fail"
    },
    "expectSan": {
      "value": [
        "api.example.com"
      ],
      "severity": "fail"
    },
    "expectFingerprint": {
      "value": "872a229969048f8dffb599a463b6438a35aa16c6eba1922db552e8560bccd508",
      "severity": "fail"
    },
    "expectKind": {
      "value": "end-entity",
      "severity": "fail"
    }
  },
  "observation": {
    "contract": 1,
    "format": "x509",
    "observation": {
      "at": "2026-09-15T14:02:11Z",
      "source": {
        "kind": "file",
        "ref": "api.example.com.crt"
      }
    },
    "target": 0,
    "certificates": [
      {
        "index": 0,
        "kind": "end-entity",
        "selfSigned": false,
        "issuedBy": [],
        "subject": {
          "cn": "api.example.com",
          "dn": "CN=api.example.com"
        },
        "issuer": {
          "cn": "Example Issuing CA 1",
          "dn": "C=US, O=Example Trust, CN=Example Issuing CA 1"
        },
        "serial": "AA584DEEFA2F58F4AD042288F149DD4C",
        "notBefore": "2026-08-01T00:00:00Z",
        "notAfter": "2026-10-30T00:00:00Z",
        "san": {
          "dns": [
            "api.example.com",
            "www.example.com"
          ],
          "ip": [],
          "email": [],
          "uri": []
        },
        "eku": [
          "serverAuth"
        ],
        "key": {
          "algorithm": "ec",
          "size": 256,
          "curve": "P-256"
        },
        "sha256": "872a229969048f8dffb599a463b6438a35aa16c6eba1922db552e8560bccd508",
        "spkiSha256": "d0c79a95047112b0e0e0c54cbe30e91b6d850cc0dea4f94543ad5ff9448d51bd",
        "derived": {
          "daysRemaining": 44.4,
          "lifetimeFraction": 0.51
        }
      }
    ],
    "warnings": []
  }
}
